created_at,username,cleaned_text,hashtags,favorite_count,retweet_count,reply_count,quote_count,image_url,location,lang,tweet_url,engagement,sentiment
2025-09-20 03:12:26+00:00,,acab 1312 resetindonesia,"['ACAB', '1312', 'ResetIndonesia']",1,0,0,0,,,und,https://x.com/undefined/status/1969238192814432604,1,neutral
2025-09-20 03:13:27+00:00,,yng bbrp jabatan gimana tu si acab,[],1,0,0,0,,,in,https://x.com/undefined/status/1969238448226598947,1,negative
2025-09-22 09:07:15+00:00,,blue laces may mean the phrase acab or more extreme that the wearer has killed a police officer,[],1,0,0,0,https://pbs.twimg.com/media/G1cIF2faoAAD_5a.jpg,,en,https://x.com/undefined/status/1970052262526652547,1,negative
2025-09-22 10:03:52+00:00,,donc acab mais pas tous les militaires pompiers de paris,[],1,0,0,0,,,fr,https://x.com/undefined/status/1970066510451556846,1,neutral
2025-09-19 22:48:04+00:00,,acab inclus aussi les pompier etoui fautlesavoir,"['etoui', 'fautlesavoir']",1,0,1,0,,,fr,https://x.com/undefined/status/1969171661690708144,1,neutral
2025-09-22 09:56:59+00:00,,disingkat acab,[],1,0,0,0,,,in,https://x.com/undefined/status/1970064777956520031,1,negative
2025-09-22 09:08:24+00:00,,literal na acab potangina niyo,[],0,0,0,0,,,tl,https://x.com/undefined/status/1970052548930511124,0,neutral
2025-09-22 10:05:02+00:00,,acab hinding hindi sila magiging kakampi,['ACAB'],0,0,0,0,,,tl,https://x.com/undefined/status/1970066804178649429,0,neutral
2025-09-20 05:55:04+00:00,,elle est juste défoncée dora la junkie et les flics à raison en ont ras le cul des punk à chien qui puent la pisse et crient acab une 86 à la main,[],0,0,0,0,,,fr,https://x.com/undefined/status/1969279120698740955,0,positive
2025-09-20 05:58:51+00:00,,acab a remplacé mort aux vaches ça c est limpide j ai pas besoin de t expliquer acab veut dire tout les flics sont des batards et la suite est donc ils faut les tuers ça a toujours été un appel aux meurtres a peine déguisés,[],0,0,1,0,,,fr,https://x.com/undefined/status/1969280073049022464,0,positive
2025-09-20 08:04:47+00:00,,ps acab surtout les fachos qui adorent frapper les gens pacifiques comme toi,[],0,0,0,0,,,fr,https://x.com/undefined/status/1969311765646238204,0,neutral
2025-09-20 08:10:18+00:00,,questce qui est tronqué ici dans le fait quun acab 520 donne un coup de pieds volontaire à une femme par derrière cest parce que tu aurais voulu être à la place du 520 et frapper toimême que tu sors ce pamphlet pour défendre lindéfendable,[],0,0,0,0,,,fr,https://x.com/undefined/status/1969313154841678132,0,positive
2025-09-21 16:41:07+00:00,,acab acab acab acab acab acab,[],0,0,0,0,,,pt,https://x.com/undefined/status/1969804091825307822,0,neutral
2025-09-21 16:54:04+00:00,,ik the police are just doing their job ofc they were told to guard and observed the rally but im not gonna be surprised if they were also told to k word the people who are protesting acab,[],0,0,0,0,,,en,https://x.com/undefined/status/1969807352682664405,0,negative
2025-09-21 16:55:28+00:00,,now i understand acab,[],0,0,0,0,,,en,https://x.com/undefined/status/1969807701967290682,0,neutral
2025-09-21 16:55:47+00:00,,acab forever and always,[],0,0,1,0,,,en,https://x.com/undefined/status/1969807783089639862,0,positive
2025-09-21 17:01:24+00:00,,acab tangina niyo,[],0,0,0,0,,,tl,https://x.com/undefined/status/1969809196381310984,0,negative
2025-09-21 17:01:52+00:00,,acab acab acab acab acab putangina niyong lahat,[],0,0,0,0,,,in,https://x.com/undefined/status/1969809312945213629,0,neutral
2025-09-19 23:02:47+00:00,,bueno dropeo the golden trueffet slh coalescence lo dropeo todo porque choque en auto y estoy bien pero se me rompio el monitor culiao y se acabo weon osea la unica wea que queria que no se rompiera se rompio wn asi que no juego mas gd hasta comprarme otro monitor se acab,[],0,0,3,0,,,es,https://x.com/undefined/status/1969175366368370954,0,positive
2025-09-19 23:06:07+00:00,,acab inclut même d killer wife je suis dévastée,[],0,0,0,0,,,fr,https://x.com/undefined/status/1969176203153097210,0,positive
2025-09-22 09:57:46+00:00,,acab i said what i said,[],0,0,0,0,,,en,https://x.com/undefined/status/1970064973700473210,0,neutral
2025-09-19 22:52:55+00:00,,yes king acab,[],0,0,0,0,,,en,https://x.com/undefined/status/1969172885190144378,0,neutral
2025-09-22 10:05:43+00:00,,ça veut pas dire que les medecins sont des fachos mais les inclure dans acab ça souligne le caractère systématiquement violent des services publics,[],0,0,0,0,,,fr,https://x.com/undefined/status/1970066976375451921,0,positive
2025-09-20 00:42:59+00:00,,great example of fa amp fo dip should have shut his mouth and showed his license but have convinced uneducated black men to resist so they can have their acab optics dude had an attitude before the cop ever approached but systemic racism,[],0,0,1,0,,,en,https://x.com/undefined/status/1969200581337108685,0,positive
2025-09-21 21:39:18+00:00,,cops beated up and arrested furries at cons before there is no reason for them to be there furs can carry acab,[],0,0,1,0,,,en,https://x.com/undefined/status/1969879132264865838,0,negative
2025-09-21 21:48:16+00:00,,tangina ng mga pulis tangina ng mga pulis mamatay na rin lahat ng protektor ng mga kurap acab acab acab,[],0,0,0,0,,,tl,https://x.com/undefined/status/1969881387542188237,0,neutral
2025-09-21 21:49:34+00:00,,así exponen al pueblo los influencers de causando desmayos por retos premiados deberían de estar apoyando a las marchas del pueblo con sus seguidores marchanacional plazasanmartin ahora dinaasesina generación z pnp acab viral,"['marchanacional', 'PlazaSanMartin', 'AHORA', 'DinaAsesina', 'viral']",0,0,0,0,https://pbs.twimg.com/ext_tw_video_thumb/1969881645525204992/pu/img/QVuzz_JypjfqNgcQ.jpg,,es,https://x.com/undefined/status/1969881715960168842,0,positive
2025-09-21 21:53:32+00:00,,habang buhay na akong galit sa mga pulis na yan magaaral ka pa lang ng crim tangina mo na wgisgsuahsjahajahsjs yikes acab,[],0,0,0,0,,,tl,https://x.com/undefined/status/1969882714519355404,0,positive
2025-09-21 22:24:11+00:00,,antifascism the thing our country stood for during ww2 acab if youre part of a system doing bad and know so you cant be considered good so police who turn a blind eye to corruption are also bad anyone celebrating death is in the wrong and what is a revolutionary communist,[],0,0,0,0,,,en,https://x.com/undefined/status/1969890428347384078,0,negative
2025-09-21 22:27:14+00:00,,faltando 10 segundo o vasco no ataque ele acab filho da puta mandado do caralho,[],0,0,0,0,,,pt,https://x.com/undefined/status/1969891195896709272,0,neutral
2025-09-21 13:15:01+00:00,,acab malala putangina,[],0,0,0,0,,,in,https://x.com/undefined/status/1969752224718033125,0,negative
2025-09-21 13:17:03+00:00,,ngayon niyo sabihing ginagawa lang nila trabaho nila trabaho ba nila ang mangharass ng mga tao tuta yang mga yan ng gobyerno acab,[],0,0,0,0,,,tl,https://x.com/undefined/status/1969752736230191484,0,neutral
2025-09-21 13:17:21+00:00,,acab inclut les frais de port,[],0,0,0,0,,,fr,https://x.com/undefined/status/1969752811454808297,0,positive
2025-09-21 13:17:23+00:00,,acab malala tangina,[],0,0,0,0,,,in,https://x.com/undefined/status/1969752819927564401,0,neutral
2025-09-21 13:18:32+00:00,,luh mga tih acab,[],0,0,0,0,,,in,https://x.com/undefined/status/1969753109045055876,0,negative
2025-09-21 13:18:39+00:00,,whatthefuck acab,['acab'],0,0,0,0,,,en,https://x.com/undefined/status/1969753140267557221,0,positive
2025-09-21 13:20:15+00:00,,fuck the government fuck the system and as always acab praying for you and the rest of my filo siblings stay safe my heart with you,[],0,0,0,0,,,en,https://x.com/undefined/status/1969753541532344670,0,positive
2025-09-21 13:20:34+00:00,,acab in ne alakası var knk anlatsana,[],0,0,1,0,,,tr,https://x.com/undefined/status/1969753620632539355,0,neutral
2025-09-22 09:12:54+00:00,,kailanman hinding hindi magiging kakampi ng mamamayan ang mga pulis sa panahon na nalalagay sa alanganin ang kapangyarihan ng mga naghaharing uri tandaan nyo yan acab,['ACAB'],0,0,0,0,,,tl,https://x.com/undefined/status/1970053681115742333,0,neutral
2025-09-22 09:33:04+00:00,,paano naman po ung mga nasugatan at kinaladkad na mga rallyista paano naman ung higit sa 200 na hinuli bakit hindi yun ang ibalita ninyong mainstream media apingapi na naman nyan ang kapulisan gayong sila itong laging marahas ang pagtrato sa mga nagpoprotesta acab mga hayop,[],0,0,0,0,,,tl,https://x.com/undefined/status/1970058756169097640,0,positive
2025-09-21 12:56:56+00:00,,acab inclut le temps de faire un truc de fou,[],0,0,0,0,,,fr,https://x.com/undefined/status/1969747673239474525,0,positive
2025-09-21 12:57:06+00:00,,idk how to stress this enough pero hindi mga pulis ang dapat nyong kaawaan kahit konting sympathy hindi nila deserve mga berdugo putangina acab,[],0,0,0,0,,,tl,https://x.com/undefined/status/1969747714864026101,0,positive
2025-09-21 12:58:38+00:00,,pazar günü ne yapılıyor acab,[],0,0,0,0,,,tr,https://x.com/undefined/status/1969748102979498243,0,neutral
2025-09-21 12:58:50+00:00,,acab mga putang ina kayo salot,[],0,0,0,0,,,tl,https://x.com/undefined/status/1969748152560587087,0,neutral
2025-09-21 13:00:11+00:00,,stop tot tot wuk wuk acab,['ACAB'],0,0,0,0,,,nl,https://x.com/undefined/status/1969748494668923326,0,neutral
2025-09-21 13:01:17+00:00,,acab mas não do jeito gay ganza palestina do bloco,[],0,0,0,0,,,pt,https://x.com/undefined/status/1969748770226307542,0,neutral
2025-09-21 13:01:57+00:00,,acab acab putangina,[],0,0,0,0,,,in,https://x.com/undefined/status/1969748937084162157,0,neutral
2025-09-21 13:03:52+00:00,,always acab,[],0,0,0,0,,,en,https://x.com/undefined/status/1969749418921615649,0,positive
2025-09-21 13:04:36+00:00,,tangina nyo talaga acab,[],0,0,0,0,,,tl,https://x.com/undefined/status/1969749602552496134,0,neutral
2025-09-21 13:06:16+00:00,,as much as i want to empathize with them i refuse to give them the benefit of the doubt until i see any substantial and progressive change within their system till then i will forever hold on to the belief that acab,[],0,0,0,0,,,en,https://x.com/undefined/status/1969750023056556522,0,positive
2025-09-21 13:06:20+00:00,,propagez la campagne acab degauchisons adroitetoute jmlp,"['ACAB', 'degauchisons', 'aDroiteToute', 'JMLP']",0,0,0,0,https://pbs.twimg.com/media/G1X07rZWgAAFd7y.jpg,,fr,https://x.com/undefined/status/1969750038583898449,0,neutral
2025-09-21 13:06:37+00:00,,acabjournalismen sitter nog i nyhetsredaktionens väggar,[],0,0,0,0,,,sv,https://x.com/undefined/status/1969750113880076500,0,neutral
2025-09-21 13:08:21+00:00,,de que te sirve estar delante de tu compañero toda la temporada si tu compañero acab haciendo podio antes que tú,[],0,0,0,0,,,es,https://x.com/undefined/status/1969750547478499754,0,positive
2025-09-21 13:13:19+00:00,,acab inclut les activités sportives pour enfants,[],0,0,0,0,,,fr,https://x.com/undefined/status/1969751798136107261,0,positive
2025-09-21 13:13:37+00:00,,putangina acab,[],0,0,0,0,,,in,https://x.com/undefined/status/1969751872526504364,0,negative
2025-09-21 21:30:44+00:00,,acab inclut les courses de saucisse,[],0,0,0,0,https://pbs.twimg.com/tweet_video_thumb/G1ZoqtvWgAALQ-a.jpg,,fr,https://x.com/undefined/status/1969876977961074999,0,positive
2025-09-21 10:45:06+00:00,,apres les profs sont carrément inclus dans acab,[],0,0,1,0,,,fr,https://x.com/undefined/status/1969714496626139614,0,neutral
2025-09-21 10:51:53+00:00,,emg semua dah gila tuh acab,[],0,0,0,0,,,in,https://x.com/undefined/status/1969716207143329830,0,negative
2025-09-21 10:58:08+00:00,,just realized 1312 is acab,[],0,0,0,0,,,en,https://x.com/undefined/status/1969717778879009191,0,neutral
2025-09-21 10:58:49+00:00,,acab inclut les gens qui ont fait le tour du monde entier pour les photos acab inclut un peu de temps pour le faire avec les filles acab inclut les plus beaux villages deurope acab inclut les plus grands succès de la vie acab inclut le code du travail,[],0,0,0,0,,,fr,https://x.com/undefined/status/1969717948018536790,0,positive
2025-09-21 22:30:24+00:00,,acab mga potangina,[],0,0,0,0,,,tl,https://x.com/undefined/status/1969891994358206741,0,positive
2025-09-21 22:31:21+00:00,,acab kakampi ng pasista,[],0,0,0,0,,,in,https://x.com/undefined/status/1969892232271626748,0,negative
2025-09-21 22:32:29+00:00,,yung mga raliyista ninakawan kaya nagalit at nagrally pero buong loob yang uuwi ng wala pang napapala mula sa gobyerno na sagot o pagbabago same same na baha at gutom so yes lahat tayo may inuuwian ding pamilya pero hindi lahat nakakatulog ng mahimbing22 acab,['ACAB'],0,0,0,0,,,tl,https://x.com/undefined/status/1969892516721021081,0,positive
2025-09-21 22:33:41+00:00,,yeah they have zero evidence but theyre clearly looking for some no shit sherlock the thing youve been suckered into believing is that such conduct is acceptable rather than the facts that acab,[],0,0,0,0,,,en,https://x.com/undefined/status/1969892817234465124,0,negative
2025-09-21 22:39:16+00:00,,they never fail to show where their true loyalties are acab,[],0,0,0,0,,,en,https://x.com/undefined/status/1969894223869890695,0,positive
2025-09-21 23:59:11+00:00,,acab america is a terrible place to live,[],0,0,0,0,,,en,https://x.com/undefined/status/1969914335008035121,0,positive
2025-09-22 00:11:45+00:00,,its the hello kitty says acab thing again,[],0,0,1,0,,,en,https://x.com/undefined/status/1969917499421450261,0,positive
2025-09-22 00:15:19+00:00,,it might sound funny sa una talaga na ibaba ang presyo ng street foods pero siya mismo mere street food vendor inaresto pa for speaking out his thoughts this is not a laughing matter acab,['acab'],0,0,0,0,,,tl,https://x.com/undefined/status/1969918396105199979,0,positive
2025-09-21 11:06:55+00:00,,acab kontol males baca jangan ajakajak,[],0,0,0,0,,,in,https://x.com/undefined/status/1969719987553407325,0,negative
2025-09-21 12:49:17+00:00,,antifa schämen sie sich autos anzünden steine werfen 1312 und acab polizeihass sowie nazigeschrei in fäkalsprache auf unseren straßen bedrohungen und sachbeschädigung das ist ihr hass auf unseren staat und alle die in bewahren wollen ihr wollt die demokratie abschaffen,[],0,0,0,0,,,de,https://x.com/undefined/status/1969745748389691888,0,positive
2025-09-21 12:54:00+00:00,,oh wtf there fucking shooting people now this is definitely all on them acab,[],0,0,0,0,,,en,https://x.com/undefined/status/1969746936682230009,0,positive
2025-09-21 12:54:24+00:00,,ich kenne nur dessen aktuellen parteiprogramm finde reiche besteuern und bezahlbare wohnräume schaffen und weniger bürokratie durchaus sinnvoll auch wenn ich mich mit der jette und ihrem acab shirt nicht identifizieren kann mit der rechten gesinnung kann ich mich noch weniger,[],0,0,0,0,,,de,https://x.com/undefined/status/1969747037752070583,0,positive
2025-09-22 00:55:43+00:00,,no masyado nang curated ang media acab,[],0,0,0,0,,,tl,https://x.com/undefined/status/1969928561873342934,0,neutral
2025-09-21 09:47:54+00:00,,potanginang mga pulis to acab kami kakampi nyo dito di yang mga naghaharing uri pota,[],0,0,0,0,,,tl,https://x.com/undefined/status/1969700103515726241,0,positive
2025-09-21 09:49:35+00:00,,fuck the ph government acab,[],0,0,0,0,,,en,https://x.com/undefined/status/1969700528721441028,0,negative
2025-09-21 09:50:23+00:00,,for more bangerr langsung dateng teater tergacorr sejogja stay safe and stay mad acab freepalestine,"['ACAB', 'FreePalestine']",0,0,0,0,,,in,https://x.com/undefined/status/1969700727753969751,0,positive
2025-09-21 09:50:27+00:00,,fuck 12 acab,[],0,0,0,0,,,en,https://x.com/undefined/status/1969700743096754575,0,negative
2025-09-21 09:53:06+00:00,,acab inclut les gens qui sont en train décrire,[],0,0,0,0,,,fr,https://x.com/undefined/status/1969701413182914950,0,neutral
2025-09-21 09:55:27+00:00,,ive never heard of awcab only acab,[],0,0,1,0,,,en,https://x.com/undefined/status/1969702004441411704,0,neutral
2025-09-21 10:02:14+00:00,,okan fiziksel olarak bu takımı bu hale nasıl getirdin acab,[],0,0,0,0,,,tr,https://x.com/undefined/status/1969703710927299019,0,neutral
2025-09-21 10:04:22+00:00,,acab unless proven otherwise,[],0,0,0,0,,,en,https://x.com/undefined/status/1969704248607916122,0,negative
2025-09-21 10:06:54+00:00,,hahahaaboyle bur kafa ivin ne iciyonuz acab maman çok kuvvetli galibayuzyilin en buyuk yolsuzlugu yapana tapiyonuz neredeyseiq nuzu kontrol ettirin,[],0,0,0,0,,,tr,https://x.com/undefined/status/1969704884791656756,0,neutral
2025-09-21 10:12:46+00:00,,acab acab acab amp i wont even change my mind,[],0,0,0,0,,,en,https://x.com/undefined/status/1969706359303356575,0,neutral
2025-09-21 10:16:54+00:00,,nou wie ze zijn en wat ze doen hadden ze gistermiddag hélémáál uit kunnen vinden in den haag én de paramilitaire knokploeg van de linkse elite doet braaf mee in opdracht acab,['ACAB'],0,0,0,0,,,nl,https://x.com/undefined/status/1969707402015760609,0,positive
2025-09-21 10:29:02+00:00,,now black people care about cops lmfao acab nigga,[],0,0,0,0,,,en,https://x.com/undefined/status/1969710456123371589,0,negative
2025-09-21 10:29:44+00:00,,sahol ng mga pulis tangina acab,[],0,0,0,0,,,tl,https://x.com/undefined/status/1969710631503958422,0,neutral
2025-09-21 10:35:52+00:00,,dulu motor bapak gw pernah ilang di depan rumah lapor polisi ga sih pak ngapain ribet ga bakal ketemu juga mending beli lagi damn tau kalo acab dari dulu beli lagi cash ga langsung sih soal ilang malem pas mau beli makan pake motor suprax yang udah lama ga dipake,[],0,0,0,0,,,in,https://x.com/undefined/status/1969712175595086232,0,negative
2025-09-21 10:40:12+00:00,,paawa effect din tong mga pulis na to sa social media eh wala kayong pinagkaiba sa mga nakaupo acab,[],0,0,0,0,,,tl,https://x.com/undefined/status/1969713264096616632,0,neutral
2025-09-22 00:36:44+00:00,,acab is an acronym standing for all cops are bastards its a slogan commonly used in protests and activism criticizing police practices and systemic issues in law enforcement,[],0,0,0,0,,,en,https://x.com/undefined/status/1969923786544968090,0,positive
2025-09-22 00:39:13+00:00,,abs gma and dzmm none of you televised the polic brutality you only highlighted the protestor and the so called rallyista police dont serve the people only the govt officials acab,[],0,0,0,0,,,en,https://x.com/undefined/status/1969924408342130827,0,positive
2025-09-22 00:40:57+00:00,,ibalik ang criminology shaming acab tangina niyo,[],0,0,0,0,,,tl,https://x.com/undefined/status/1969924848404316438,0,negative
2025-09-22 00:43:40+00:00,,acab inclut les personnes âgées,[],0,0,0,0,,,fr,https://x.com/undefined/status/1969925530758615284,0,positive
2025-09-21 13:22:25+00:00,,tangina wtf acab,[],0,0,0,0,,,pt,https://x.com/undefined/status/1969754088784199972,0,neutral
2025-09-21 13:22:27+00:00,,tanginang mga pulis talaga yan oh pinoprotektahan ang mga nasa tuktok at pinupuksa ang mga nasa laylayan damuho taksil acab,[],0,0,0,0,,,tl,https://x.com/undefined/status/1969754098070368283,0,positive
2025-09-21 13:23:48+00:00,,acab inclut les frais de ports,[],0,0,0,0,,,fr,https://x.com/undefined/status/1969754434545574213,0,positive
2025-09-21 13:23:49+00:00,,acab pa rin,[],0,0,0,0,,,in,https://x.com/undefined/status/1969754441772581252,0,negative
2025-09-21 13:24:02+00:00,,acab acab mf acab,[],0,0,0,0,,,pt,https://x.com/undefined/status/1969754494683762819,0,neutral
2025-09-21 13:24:05+00:00,,ulan hem ciasal i̇slamcılar hem bizim için utanç ve yüz kızartıcı tablo hala neyi bekliyor acab ticareti bile hala alttan alttan yürütüyor,[],0,0,0,0,https://pbs.twimg.com/media/G1X5SL-WsAAYWRN.jpg,,tr,https://x.com/undefined/status/1969754505685131688,0,neutral
2025-09-21 13:24:28+00:00,,acab things will never change here as long as we go against fellow citizens who are just as angry as we are and are also fighting the way they know how the politicians and the goons know they will get away with it all because all we care about is our own comfort,[],0,0,0,0,,,en,https://x.com/undefined/status/1969754605606305816,0,positive
2025-09-21 13:25:22+00:00,,putangina acab mga tuta ng gobyerno,[],0,0,0,0,,,tl,https://x.com/undefined/status/1969754831146647620,0,neutral
2025-09-21 19:26:14+00:00,,acab all day long,[],0,0,0,0,,,en,https://x.com/undefined/status/1969845644006158386,0,positive
2025-09-21 19:27:42+00:00,,walang inosenteng pulis lahat sila complicit sa ginagawa sating kademonyohan ng gobyerno acab,[],0,0,1,0,,,tl,https://x.com/undefined/status/1969846015772741783,0,neutral
2025-09-21 19:29:07+00:00,,acab inclut les québecois désolé,[],0,0,0,0,,,fr,https://x.com/undefined/status/1969846373098111073,0,positive
2025-09-21 19:29:25+00:00,,bunun arkasında yine bir i̇ngiliz oyunumu var acab,[],0,0,0,0,,,tr,https://x.com/undefined/status/1969846446968213625,0,neutral
2025-09-21 08:33:25+00:00,,so zu tun als hätte die antifa das gg im sinn wenn sie als gewaltbereite gruppe ihre aktionen machen ist ziemlich realitätsfern das ist doch auch die acabcrew nene sie täuschen sich,[],0,0,0,0,,,de,https://x.com/undefined/status/1969681360341049633,0,positive
2025-09-21 08:39:07+00:00,,tangina acab,[],0,0,0,0,,,in,https://x.com/undefined/status/1969682794592022721,0,positive
2025-09-21 08:42:56+00:00,,tangina niyo acab bobong mga puta,[],0,0,0,0,,,tl,https://x.com/undefined/status/1969683754156515651,0,neutral
2025-09-21 08:46:25+00:00,,may naglive sa tiktok and nakuha na ang saya ng mga pulis na may nahuli silang raliyesta kaya pinaend yung live bahasaluneta kurakotmanagot acab,"['BahaSaLuneta', 'KurakotManagot', 'ACAB']",0,0,0,0,,,tl,https://x.com/undefined/status/1969684628933148742,0,neutral
2025-09-21 08:55:13+00:00,,acab power to the people of britain,[],0,0,0,0,,,en,https://x.com/undefined/status/1969686843332698273,0,negative
2025-09-21 09:02:07+00:00,,acab inclut les frais denvoi via un site internet du club de foot cest vrai que cest la pire chose qui existe ça,[],0,0,0,0,,,fr,https://x.com/undefined/status/1969688579698741576,0,positive
2025-09-21 09:02:28+00:00,,y no se lo di el verdadero acab,[],0,0,1,0,,,es,https://x.com/undefined/status/1969688669511463038,0,neutral
2025-09-21 09:16:10+00:00,,acab gaji dibayar rakyat tapi nak tindas rakyat sialnya jadi manusia,[],0,0,0,0,,,in,https://x.com/undefined/status/1969692115652255992,0,negative
2025-09-21 09:21:57+00:00,,acab both in rl and fiction anjing polisinya goblok banget tolol queenmantisep5,['QueenMantisEp5'],0,0,0,0,,,tl,https://x.com/undefined/status/1969693573856866566,0,negative
2025-09-21 09:25:30+00:00,,acab around the world,[],0,0,0,0,,,en,https://x.com/undefined/status/1969694467444682991,0,positive
2025-09-21 09:38:14+00:00,,acab inclut les hommes,[],0,0,0,0,,,fr,https://x.com/undefined/status/1969697670966227082,0,positive
2025-09-21 09:41:32+00:00,,acab inclut les recherches pour the summer et le prix total,[],0,0,0,0,,,fr,https://x.com/undefined/status/1969698498963497058,0,positive
2025-09-22 00:15:46+00:00,,acab mga putangina niyooo,[],0,0,0,0,,,tl,https://x.com/undefined/status/1969918507455574330,0,positive
2025-09-22 00:18:40+00:00,,acab acab acab acab acab acab acab acab acab acab acab acab,[],0,0,0,0,,,in,https://x.com/undefined/status/1969919238908584203,0,neutral
2025-09-22 00:23:52+00:00,,conchatumare dónde está el respeto en disparar a quemarropa al protestante que corre de las lacrimógenas que tiran tus perros de mierda acab y cada vez más recio en mi postura en contra de la institución más prostituida del estado perrera nacional del perú,[],0,0,0,0,,,es,https://x.com/undefined/status/1969920547266916370,0,positive
2025-09-22 00:31:34+00:00,,acab bajingan,[],0,0,0,0,,,in,https://x.com/undefined/status/1969922486818283715,0,negative
2025-09-22 01:11:23+00:00,,acab talaga,[],0,0,0,0,,,in,https://x.com/undefined/status/1969932503977984325,0,neutral
2025-09-22 01:17:37+00:00,,i wish the worst for people like him fuck them all acab indeed,[],0,0,0,0,,,en,https://x.com/undefined/status/1969934073629159848,0,positive
2025-09-22 01:21:11+00:00,,ito na ba yung tinatawag na maximum tolerance ng pnp acab,[],0,0,0,0,,,tl,https://x.com/undefined/status/1969934970316849423,0,neutral
2025-09-21 06:06:24+00:00,,dang biarpun gw gila tapi gw bakal selalu ingat freepalestine and negara kita belum menang guis resetindonesia acab,"['FreePalestine', 'resetindonesia', 'acab']",0,0,1,0,,,in,https://x.com/undefined/status/1969644362847174931,0,neutral
2025-09-21 06:24:18+00:00,,acab tangina ng mga pulis,[],0,0,0,0,,,tl,https://x.com/undefined/status/1969648865734508881,0,neutral
2025-09-21 06:32:21+00:00,,atas nama acab,[],0,0,0,0,,,pt,https://x.com/undefined/status/1969650889750429886,0,neutral
2025-09-21 06:32:45+00:00,,il ny a que les idiots qui inclus les profs dans acab,[],0,0,0,0,,,fr,https://x.com/undefined/status/1969650993252937806,0,negative
2025-09-21 06:55:22+00:00,,kamutipesayabanget parcok acab,"['KamuTipeSayaBanget', 'ParCok', 'ACAB']",0,0,0,0,https://pbs.twimg.com/ext_tw_video_thumb/1969656644037722114/pu/img/A_MICpo0W5gI3iLZ.jpg,,qme,https://x.com/undefined/status/1969656684491731161,0,neutral
2025-09-21 06:56:57+00:00,,malas baca jadi acab udah itu aja,[],0,0,0,0,,,in,https://x.com/undefined/status/1969657081205834099,0,negative
2025-09-21 06:58:05+00:00,,pagan satanist tenrikyou witch artist writer autistic adhd pdid hpd npd ocd depression soad madd dpdr alterhuman polymorph ancom punk blm acab dtab intersectional revfem trans rights inkqueer clusqueer prochoice landback selfshipper,[],0,0,1,0,,,en,https://x.com/undefined/status/1969657367307448754,0,neutral
2025-09-21 08:01:35+00:00,,pablo escobar hat es richtig gemacht kopfprämie pro bulle und staatsbüttel acab,[],0,0,0,0,,,de,https://x.com/undefined/status/1969673347899539525,0,positive
